{
  "capabilities": "0.10.0",
  "ynh_version": "0.3.1",
  "harness": "local/demo",
  "summary": { "total": 3, "recorded": 2, "unrecorded": 1, "forgiven": 14 },
  "sensors": [
    {
      "name": "build", "kind": "command", "ratchet": "fingerprint", "recorded": false
    },
    {
      "name": "lint", "kind": "command", "ratchet": "fingerprint", "recorded": true,
      "recorded_at": "2026-08-20T09:14:02Z", "status": "fail", "forgiven": 12, "total": 12,
      "findings": [
        "internal/handler/route.go:41: error return value not checked",
        "internal/handler/route.go:88: error return value not checked"
      ]
    },
    {
      "name": "suppressions", "kind": "command", "ratchet": "count", "recorded": true,
      "recorded_at": "2026-08-22T11:03:55Z", "status": "fail", "forgiven": 2, "total": 5,
      "truncated": false
    }
  ]
}
